{
  "schema_version": "typing-problem-presets-v1",
  "duration_seconds": 180,
  "content_origin": "original",
  "design_note": "単語、短文、長文を組み合わせた180秒競技向けの複合問題。問題文はすべて本大会向けの新規作成。",
  "preset_policy": {
    "main_presets": 3,
    "reserve_presets": 7,
    "problems_per_preset": 36,
    "composition": {
      "word": 12,
      "short_sentence": 12,
      "long_sentence": 12
    },
    "order": "word_then_short_sentence_then_long_sentence",
    "after_last_problem": "loop_to_first"
  },
  "difficulty_balance": {
    "method": "typing-input-tests-v1の許可系列から算出した最短入力キー数",
    "accepted_range_per_cycle": {
      "minimum": 1450,
      "maximum": 1650
    },
    "observed_minimum": 1463,
    "observed_maximum": 1648,
    "preset_minimum_keystrokes": {
      "typing-main-01": 1560,
      "typing-main-02": 1648,
      "typing-main-03": 1579,
      "typing-reserve-01": 1463,
      "typing-reserve-02": 1569,
      "typing-reserve-03": 1603,
      "typing-reserve-04": 1606,
      "typing-reserve-05": 1562,
      "typing-reserve-06": 1615,
      "typing-reserve-07": 1586
    }
  },
  "presets": [
    {
      "problem_set_id": "typing-main-01",
      "version": 1,
      "role": "main",
      "match_number": 1,
      "title": "朝の学校",
      "problems": [
        {
          "problem_id": "m01-w01",
          "order": 1,
          "type": "word",
          "display_text": "青空",
          "reading": "あおぞら"
        },
        {
          "problem_id": "m01-w02",
          "order": 2,
          "type": "word",
          "display_text": "靴音",
          "reading": "くつおと"
        },
        {
          "problem_id": "m01-w03",
          "order": 3,
          "type": "word",
          "display_text": "時間割",
          "reading": "じかんわり"
        },
        {
          "problem_id": "m01-w04",
          "order": 4,
          "type": "word",
          "display_text": "図書室",
          "reading": "としょしつ"
        },
        {
          "problem_id": "m01-w05",
          "order": 5,
          "type": "word",
          "display_text": "校門",
          "reading": "こうもん"
        },
        {
          "problem_id": "m01-w06",
          "order": 6,
          "type": "word",
          "display_text": "朝礼",
          "reading": "ちょうれい"
        },
        {
          "problem_id": "m01-w07",
          "order": 7,
          "type": "word",
          "display_text": "黒板",
          "reading": "こくばん"
        },
        {
          "problem_id": "m01-w08",
          "order": 8,
          "type": "word",
          "display_text": "予鈴",
          "reading": "よれい"
        },
        {
          "problem_id": "m01-w09",
          "order": 9,
          "type": "word",
          "display_text": "教科書",
          "reading": "きょうかしょ"
        },
        {
          "problem_id": "m01-w10",
          "order": 10,
          "type": "word",
          "display_text": "筆箱",
          "reading": "ふでばこ"
        },
        {
          "problem_id": "m01-w11",
          "order": 11,
          "type": "word",
          "display_text": "登校",
          "reading": "とうこう"
        },
        {
          "problem_id": "m01-w12",
          "order": 12,
          "type": "word",
          "display_text": "日直",
          "reading": "にっちょく"
        },
        {
          "problem_id": "m01-s01",
          "order": 13,
          "type": "short_sentence",
          "display_text": "朝の光が窓から差し込む。",
          "reading": "あさのひかりがまどからさしこむ。"
        },
        {
          "problem_id": "m01-s02",
          "order": 14,
          "type": "short_sentence",
          "display_text": "教室の時計が静かに進む。",
          "reading": "きょうしつのとけいがしずかにすすむ。"
        },
        {
          "problem_id": "m01-s03",
          "order": 15,
          "type": "short_sentence",
          "display_text": "忘れ物がないかもう一度確かめる。",
          "reading": "わすれものがないかもういちどたしかめる。"
        },
        {
          "problem_id": "m01-s04",
          "order": 16,
          "type": "short_sentence",
          "display_text": "廊下では元気な挨拶が聞こえる。",
          "reading": "ろうかではげんきなあいさつがきこえる。"
        },
        {
          "problem_id": "m01-s05",
          "order": 17,
          "type": "short_sentence",
          "display_text": "校門の前で友達と出会う。",
          "reading": "こうもんのまえでともだちとであう。"
        },
        {
          "problem_id": "m01-s06",
          "order": 18,
          "type": "short_sentence",
          "display_text": "日直が黒板をきれいに消す。",
          "reading": "にっちょくがこくばんをきれいにけす。"
        },
        {
          "problem_id": "m01-s07",
          "order": 19,
          "type": "short_sentence",
          "display_text": "予鈴を聞いて急いで席に着く。",
          "reading": "よれいをきいていそいでせきにつく。"
        },
        {
          "problem_id": "m01-s08",
          "order": 20,
          "type": "short_sentence",
          "display_text": "教科書と筆箱を机に並べる。",
          "reading": "きょうかしょとふでばこをつくえにならべる。"
        },
        {
          "problem_id": "m01-s09",
          "order": 21,
          "type": "short_sentence",
          "display_text": "窓を開けると涼しい風が入る。",
          "reading": "まどをあけるとすずしいかぜがはいる。"
        },
        {
          "problem_id": "m01-s10",
          "order": 22,
          "type": "short_sentence",
          "display_text": "今日の目標をノートに書き留める。",
          "reading": "きょうのもくひょうをのーとにかきとめる。"
        },
        {
          "problem_id": "m01-s11",
          "order": 23,
          "type": "short_sentence",
          "display_text": "先生が来る前に宿題を確認する。",
          "reading": "せんせいがくるまえにしゅくだいをかくにんする。"
        },
        {
          "problem_id": "m01-s12",
          "order": 24,
          "type": "short_sentence",
          "display_text": "朝礼の知らせが校内に流れる。",
          "reading": "ちょうれいのしらせがこうないにながれる。"
        },
        {
          "problem_id": "m01-l01",
          "order": 25,
          "type": "long_sentence",
          "display_text": "朝の会が始まる前に、今日の予定を仲間と確認し、一日の流れを頭に入れた。",
          "reading": "あさのかいがはじまるまえに、きょうのよていをなかまとかくにんし、いちにちのながれをあたまにいれた。"
        },
        {
          "problem_id": "m01-l02",
          "order": 26,
          "type": "long_sentence",
          "display_text": "図書室の窓辺で本を開くと、校庭から明るい声が届き、風でカーテンが揺れていた。",
          "reading": "としょしつのまどべでほんをひらくと、こうていからあかるいこえがとどき、かぜでかーてんがゆれていた。"
        },
        {
          "problem_id": "m01-l03",
          "order": 27,
          "type": "long_sentence",
          "display_text": "授業の準備を早めに終えると、落ち着いた気持ちで先生の話を聞ける。",
          "reading": "じゅぎょうのじゅんびをはやめにおえると、おちついたきもちでせんせいのはなしをきける。"
        },
        {
          "problem_id": "m01-l04",
          "order": 28,
          "type": "long_sentence",
          "display_text": "小さな目標を一つ決めて、昨日より少しだけ前へ進む一日にしよう。",
          "reading": "ちいさなもくひょうをひとつきめて、きのうよりすこしだけまえへすすむいちにちにしよう。"
        },
        {
          "problem_id": "m01-l05",
          "order": 29,
          "type": "long_sentence",
          "display_text": "校門をくぐると部活動の朝練習を終えた生徒が戻ってきて、にぎやかな一日が始まった。",
          "reading": "こうもんをくぐるとぶかつどうのあされんしゅうをおえたせいとがもどってきて、にぎやかないちにちがはじまった。"
        },
        {
          "problem_id": "m01-l06",
          "order": 30,
          "type": "long_sentence",
          "display_text": "教室へ入って窓を開け、机の上を整えてから、今日使う教科書を時間割の順に並べた。",
          "reading": "きょうしつへはいってまどをあけ、つくえのうえをととのえてから、きょうつかうきょうかしょをじかんわりのじゅんにならべた。"
        },
        {
          "problem_id": "m01-l07",
          "order": 31,
          "type": "long_sentence",
          "display_text": "朝の短い時間でも先に課題を確認しておけば、授業が始まってから慌てずに集中できる。",
          "reading": "あさのみじかいじかんでもさきにかだいをかくにんしておけば、じゅぎょうがはじまってからあわてずにしゅうちゅうできる。"
        },
        {
          "problem_id": "m01-l08",
          "order": 32,
          "type": "long_sentence",
          "display_text": "友達と昨日の出来事を話しているうちに予鈴が鳴り、全員がそれぞれの席へ戻っていった。",
          "reading": "ともだちときのうのできごとをはなしているうちによれいがなり、ぜんいんがそれぞれのせきへもどっていった。"
        },
        {
          "problem_id": "m01-l09",
          "order": 33,
          "type": "long_sentence",
          "display_text": "日直は黒板の日付を書き直し、配布物の枚数を数えて、朝の会に必要な準備を整えた。",
          "reading": "にっちょくはこくばんのひづけをかきなおし、はいふぶつのまいすうをかぞえて、あさのかいにひつようなじゅんびをととのえた。"
        },
        {
          "problem_id": "m01-l10",
          "order": 34,
          "type": "long_sentence",
          "display_text": "校庭から聞こえる元気な掛け声に耳を傾けながら、静かな教室で一時間目の予習を進めた。",
          "reading": "こうていからきこえるげんきなかけごえにみみをかたむけながら、しずかなきょうしつでいちじかんめのよしゅうをすすめた。"
        },
        {
          "problem_id": "m01-l11",
          "order": 35,
          "type": "long_sentence",
          "display_text": "忘れ物に気づいた友達へ予備の筆記用具を貸すと、安心した表情で何度もお礼を言われた。",
          "reading": "わすれものにきづいたともだちへよびのひっきようぐをかすと、あんしんしたひょうじょうでなんどもおれいをいわれた。"
        },
        {
          "problem_id": "m01-l12",
          "order": 36,
          "type": "long_sentence",
          "display_text": "朝に決めた小さな目標を意識して過ごすと、放課後には一日の成長をはっきり感じられた。",
          "reading": "あさにきめたちいさなもくひょうをいしきしてすごすと、ほうかごにはいちにちのせいちょうをはっきりかんじられた。"
        }
      ]
    },
    {
      "problem_set_id": "typing-main-02",
      "version": 1,
      "role": "main",
      "match_number": 2,
      "title": "情報と技術",
      "problems": [
        {
          "problem_id": "m02-w01",
          "order": 1,
          "type": "word",
          "display_text": "端末",
          "reading": "たんまつ"
        },
        {
          "problem_id": "m02-w02",
          "order": 2,
          "type": "word",
          "display_text": "通信",
          "reading": "つうしん"
        },
        {
          "problem_id": "m02-w03",
          "order": 3,
          "type": "word",
          "display_text": "設計図",
          "reading": "せっけいず"
        },
        {
          "problem_id": "m02-w04",
          "order": 4,
          "type": "word",
          "display_text": "キーボード",
          "reading": "きーぼーど"
        },
        {
          "problem_id": "m02-w05",
          "order": 5,
          "type": "word",
          "display_text": "回路基板",
          "reading": "かいろきばん"
        },
        {
          "problem_id": "m02-w06",
          "order": 6,
          "type": "word",
          "display_text": "暗号化",
          "reading": "あんごうか"
        },
        {
          "problem_id": "m02-w07",
          "order": 7,